{
  "adapter_catalog": [
    "gum-grid-v1",
    "gum-two-rocket-asteroids-v1",
    "gum-cooperative-immune-v1",
    "gum-object-laboratory-v1",
    "gum-causal-workshop-v1",
    "gum-changing-maze-v1",
    "gum-physics-playground-v1",
    "gum-logic-chamber-v1",
    "gum-language-classroom-v1",
    "gum-cooperation-world-v1",
    "gum-artifact-workshop-v1",
    "gum-sealed-finals-v1"
  ],
  "capability_catalog": [
    "entity-attention",
    "object-persistence",
    "occlusion-tracking",
    "comparison",
    "categorization",
    "control-grounding",
    "causal-intervention",
    "affordance-discovery",
    "immediate-prediction",
    "event-concept-formation",
    "skill-retention",
    "spatial-memory",
    "replanning",
    "strategy-revision",
    "prerequisite-planning",
    "counterfactual-reasoning",
    "momentum-prediction",
    "collision-timing",
    "grounded-language",
    "clarification",
    "evidence-linked-explanation",
    "selective-communication",
    "role-selection",
    "cooperation-necessity",
    "rapid-visual-control",
    "safe-artifact-work",
    "source-preservation",
    "independent-validation",
    "cross-family-transfer",
    "skill-composition"
  ],
  "curriculum_id": "gum-school-v1",
  "examinations": [
    {
      "adapter": "gum-object-laboratory-v1",
      "capabilities": [
        "object-persistence",
        "occlusion-tracking",
        "categorization"
      ],
      "control_baselines": [
        "matched-fresh",
        "random"
      ],
      "examination_id": "exam.object-laboratory.transfer.v1",
      "freeze_requirements": [
        "learner",
        "school-engine",
        "curriculum",
        "adapters",
        "source-hashes"
      ],
      "interaction_budget": 5120,
      "learner_inputs": [
        "rgb-pixels",
        "anonymous-action-slots",
        "scalar-reward",
        "termination-signal",
        "public-info"
      ],
      "metrics": [
        "success",
        "efficiency",
        "uncertainty",
        "unnecessary-actions"
      ],
      "prohibited_inputs": [
        "audit-only-state",
        "action-meanings",
        "goal-coordinates",
        "sealed-seeds",
        "task-solution"
      ],
      "schema": "gum-school-examination-v1",
      "school": "object-laboratory",
      "selection": {
        "authority": "independent-evaluator",
        "commitment_scope": "selection-protocol",
        "protocol": "post-freeze-independent-v1",
        "revealed_after_freeze": true,
        "sealed_seed_commitment": "sha256:378ce197b4d8f98b81c97fc2d4501a83205e7a7d44d984e1ef2ea7aa8e4c0451",
        "selected_before_evaluated_run": true,
        "status": "selection-protocol-committed"
      },
      "title": "Object identity under withheld appearance and occlusion shifts",
      "trials": 32
    },
    {
      "adapter": "gum-causal-workshop-v1",
      "capabilities": [
        "control-grounding",
        "causal-intervention",
        "skill-composition"
      ],
      "control_baselines": [
        "matched-fresh",
        "random"
      ],
      "examination_id": "exam.causal-workshop.transfer.v1",
      "freeze_requirements": [
        "learner",
        "school-engine",
        "curriculum",
        "adapters",
        "source-hashes"
      ],
      "interaction_budget": 6400,
      "learner_inputs": [
        "rgb-pixels",
        "anonymous-action-slots",
        "scalar-reward",
        "termination-signal",
        "public-info"
      ],
      "metrics": [
        "success",
        "efficiency",
        "uncertainty",
        "unnecessary-actions"
      ],
      "prohibited_inputs": [
        "audit-only-state",
        "control-map",
        "mechanism-description",
        "sealed-seeds",
        "task-solution"
      ],
      "schema": "gum-school-examination-v1",
      "school": "causal-workshop",
      "selection": {
        "authority": "independent-evaluator",
        "commitment_scope": "selection-protocol",
        "protocol": "post-freeze-independent-v1",
        "revealed_after_freeze": true,
        "sealed_seed_commitment": "sha256:7c643e564c1d86d0402919635c2ac7f1bddb7b94ac8ebc04bf7cd2b14ac17d36",
        "selected_before_evaluated_run": true,
        "status": "selection-protocol-committed"
      },
      "title": "Causal tool use under withheld control and dependency shifts",
      "trials": 32
    },
    {
      "adapter": "gum-changing-maze-v1",
      "capabilities": [
        "spatial-memory",
        "replanning",
        "strategy-revision"
      ],
      "control_baselines": [
        "matched-fresh",
        "random"
      ],
      "examination_id": "exam.changing-maze.transfer.v1",
      "freeze_requirements": [
        "learner",
        "school-engine",
        "curriculum",
        "adapters",
        "source-hashes"
      ],
      "interaction_budget": 7680,
      "learner_inputs": [
        "rgb-pixels",
        "anonymous-action-slots",
        "scalar-reward",
        "termination-signal",
        "public-info"
      ],
      "metrics": [
        "success",
        "efficiency",
        "uncertainty",
        "unnecessary-actions"
      ],
      "prohibited_inputs": [
        "audit-only-state",
        "control-map",
        "goal-coordinates",
        "sealed-seeds",
        "task-solution"
      ],
      "schema": "gum-school-examination-v1",
      "school": "changing-maze",
      "selection": {
        "authority": "independent-evaluator",
        "commitment_scope": "selection-protocol",
        "protocol": "post-freeze-independent-v1",
        "revealed_after_freeze": true,
        "sealed_seed_commitment": "sha256:5f72e2e26f3a1e1de722ea0d231cdbb89b2f967c30b3d25b25b548cd4f8c35a0",
        "selected_before_evaluated_run": true,
        "status": "selection-protocol-committed"
      },
      "title": "Navigation after withheld topology and control shifts",
      "trials": 32
    }
  ],
  "lessons": [
    {
      "adapter": "gum-object-laboratory-v1",
      "authored_family": "object-identity-through-occlusion",
      "baseline": {
        "controls": [
          "candidate-before-training",
          "matched-fresh",
          "random"
        ],
        "same_perception": true,
        "same_resource_limits": true,
        "trials": 24
      },
      "capabilities": [
        "entity-attention",
        "object-persistence",
        "occlusion-tracking"
      ],
      "evaluation": {
        "development_seeds": [
          11101,
          11102,
          11103,
          11104
        ],
        "examination_ids": [
          "exam.object-laboratory.transfer.v1"
        ],
        "metrics": [
          "success",
          "efficiency",
          "uncertainty",
          "unnecessary-actions"
        ],
        "new_seed_trials": 16,
        "structurally_shifted": true,
        "trials": 32
      },
      "evidence": {
        "hash_algorithm": "sha256",
        "preserve_failures": true,
        "protocol_hashes": true,
        "replay_metadata": true,
        "source_hashes": true,
        "trajectories": true
      },
      "failure_policy": {
        "abort_on_limit_breach": true,
        "quarantine_candidate": true,
        "record_diagnosis": true,
        "rollback_to_promoted": true
      },
      "grade": 1,
      "learner_inputs": [
        "rgb-pixels",
        "anonymous-action-slots",
        "scalar-reward",
        "termination-signal",
        "public-info"
      ],
      "lesson_id": "object-laboratory.occlusion.001",
      "prerequisites": [],
      "prohibited_inputs": [
        "audit-only-state",
        "action-meanings",
        "goal-coordinates",
        "hazard-coordinates",
        "concept-assignment",
        "sealed-seeds",
        "task-solution"
      ],
      "promotion": {
        "confidence_level": 0.95,
        "maximum_uncertainty_rate": 0.2,
        "maximum_unnecessary_action_rate": 0.25,
        "minimum_fresh_advantage": 1.1,
        "minimum_fresh_advantage_lower_bound": 1.0,
        "minimum_success": 0.8,
        "minimum_success_lower_bound": 0.65,
        "required_gates": [
          "sealed-performance",
          "retention",
          "evidence-integrity",
          "resource-limits",
          "control-advantage",
          "input-boundary",
          "replay"
        ]
      },
      "rationale": "The learner must preserve an object's identity when it disappears briefly and returns with a changed surface cue, rather than matching a fixed color.",
      "resource_limits": {
        "artifact_storage_mb": 512,
        "max_interactions": 12000,
        "peak_memory_mb": 2048,
        "wall_clock_seconds": 1800
      },
      "retention": {
        "evaluation_seeds": [
          11201,
          11202,
          11203,
          11204
        ],
        "maximum_regression": 0.05,
        "protected_skills": [],
        "scope": "all-promoted-skills",
        "trials": 24
      },
      "schema": "gum-school-lesson-v1",
      "school": "object-laboratory",
      "sequence": 1,
      "title": "Track one object through occlusion and appearance change",
      "training": {
        "generator": "authored-object-occlusion-v1",
        "interaction_budget": 12000,
        "seeds": [
          11001,
          11002,
          11003,
          11004
        ],
        "worlds_per_seed": 3
      },
      "world_admission_id": "admission.object-laboratory.v1"
    },
    {
      "adapter": "gum-object-laboratory-v1",
      "authored_family": "object-function-across-appearance",
      "baseline": {
        "controls": [
          "candidate-before-training",
          "matched-fresh",
          "random"
        ],
        "same_perception": true,
        "same_resource_limits": true,
        "trials": 24
      },
      "capabilities": [
        "comparison",
        "categorization",
        "event-concept-formation"
      ],
      "evaluation": {
        "development_seeds": [
          11111,
          11112,
          11113,
          11114